[
  {
    "ProductionPhaseID": "GRBK-32-CL:P1",
    "BoatModelID": "GRBK-32-CL",
    "Sequence": 1,
    "StartYear": 1965,
    "EndYear": 1973,
    "BoundaryPrecision": "within_year",
    "TransitionYears": [
      1973
    ],
    "LabelKey": "phase.GR.BK32.wood",
    "ReasonCodes": [
      "construction_change"
    ],
    "ApplicabilityNote": "Wood construction through the 1973 transition. A year-only match for 1973 is insufficient to determine material.",
    "FactOverrides": [
      {
        "FieldID": "HullMaterialCode",
        "ValueState": "known",
        "CanonicalValue": "hull_material.wood",
        "CanonicalUnit": null,
        "Confidence": "high",
        "EvidenceAssertionIDs": [
          "GRBK-32-CL-material"
        ],
        "ResolutionNote": "Phase-specific construction; not a separate canonical model."
      }
    ],
    "EvidenceAssertionIDs": [
      "GRBK-32-CL-material"
    ],
    "Notes": "Same Grand Banks 32 Sedan model identity; construction differs."
  },
  {
    "ProductionPhaseID": "GRBK-32-CL:P2",
    "BoatModelID": "GRBK-32-CL",
    "Sequence": 2,
    "StartYear": 1973,
    "EndYear": 1995,
    "BoundaryPrecision": "within_year",
    "TransitionYears": [
      1973
    ],
    "LabelKey": "phase.GR.BK32.fiberglass",
    "ReasonCodes": [
      "construction_change"
    ],
    "ApplicabilityNote": "Fiberglass production begins during the 1973 transition. A 1973 listing needs hull material or hull-number evidence to select the phase.",
    "FactOverrides": [
      {
        "FieldID": "HullMaterialCode",
        "ValueState": "known",
        "CanonicalValue": "hull_material.fiberglass",
        "CanonicalUnit": null,
        "Confidence": "high",
        "EvidenceAssertionIDs": [
          "GRBK-32-CL-material"
        ],
        "ResolutionNote": "Phase-specific construction; not a separate canonical model."
      }
    ],
    "EvidenceAssertionIDs": [
      "GRBK-32-CL-material"
    ],
    "Notes": "Dimensions remain model-wide because no material dimensional break is being asserted."
  },
  {
    "ProductionPhaseID": "GRBK-36-CL:P1",
    "BoatModelID": "GRBK-36-CL",
    "Sequence": 1,
    "StartYear": 1965,
    "EndYear": 1973,
    "BoundaryPrecision": "within_year",
    "TransitionYears": [
      1973
    ],
    "LabelKey": "phase.GR.BK36.wood_original",
    "ReasonCodes": [
      "construction_change"
    ],
    "ApplicabilityNote": "Original-size wood hull. Fiberglass transition occurred during 1973.",
    "FactOverrides": [
      {
        "FieldID": "HullMaterialCode",
        "ValueState": "known",
        "CanonicalValue": "hull_material.wood",
        "CanonicalUnit": null,
        "Confidence": "high",
        "EvidenceAssertionIDs": [
          "GRBK-36-CL-material"
        ],
        "ResolutionNote": null
      },
      {
        "FieldID": "LOA",
        "ValueState": "known",
        "CanonicalValue": 11.0744,
        "CanonicalUnit": "m",
        "Confidence": "high",
        "EvidenceAssertionIDs": [
          "GRBK-36-CL-sizechange"
        ],
        "ResolutionNote": "Original hull length."
      },
      {
        "FieldID": "Beam",
        "ValueState": "known",
        "CanonicalValue": 3.7084,
        "CanonicalUnit": "m",
        "Confidence": "high",
        "EvidenceAssertionIDs": [
          "GRBK-36-CL-beamchange"
        ],
        "ResolutionNote": "Original hull beam."
      }
    ],
    "EvidenceAssertionIDs": [
      "GRBK-36-CL-material",
      "GRBK-36-CL-sizechange",
      "GRBK-36-CL-beamchange"
    ],
    "Notes": "Construction change does not create a new model."
  },
  {
    "ProductionPhaseID": "GRBK-36-CL:P2",
    "BoatModelID": "GRBK-36-CL",
    "Sequence": 2,
    "StartYear": 1973,
    "EndYear": 1987,
    "BoundaryPrecision": "transition_years",
    "TransitionYears": [
      1973,
      1987,
      1988
    ],
    "LabelKey": "phase.GR.BK36.fiberglass_original",
    "ReasonCodes": [
      "construction_change",
      "hull_redesign",
      "dimension_change"
    ],
    "ApplicabilityNote": "Original-size fiberglass hull. The later enlargement is reported around 1987/88, so boundary-year boats may require hull-specific evidence.",
    "FactOverrides": [
      {
        "FieldID": "HullMaterialCode",
        "ValueState": "known",
        "CanonicalValue": "hull_material.fiberglass",
        "CanonicalUnit": null,
        "Confidence": "high",
        "EvidenceAssertionIDs": [
          "GRBK-36-CL-material"
        ],
        "ResolutionNote": null
      },
      {
        "FieldID": "LOA",
        "ValueState": "known",
        "CanonicalValue": 11.0744,
        "CanonicalUnit": "m",
        "Confidence": "high",
        "EvidenceAssertionIDs": [
          "GRBK-36-CL-sizechange"
        ],
        "ResolutionNote": "Original fiberglass hull length."
      },
      {
        "FieldID": "Beam",
        "ValueState": "known",
        "CanonicalValue": 3.7084,
        "CanonicalUnit": "m",
        "Confidence": "medium",
        "EvidenceAssertionIDs": [
          "GRBK-36-CL-beamchange"
        ],
        "ResolutionNote": "Source places the beam update around 1988."
      }
    ],
    "EvidenceAssertionIDs": [
      "GRBK-36-CL-material",
      "GRBK-36-CL-sizechange",
      "GRBK-36-CL-beamchange"
    ],
    "Notes": "Boundary is intentionally conservative because sources describe the length and beam changes as 1987/88."
  },
  {
    "ProductionPhaseID": "GRBK-36-CL:P3",
    "BoatModelID": "GRBK-36-CL",
    "Sequence": 3,
    "StartYear": 1987,
    "EndYear": 2004,
    "BoundaryPrecision": "transition_years",
    "TransitionYears": [
      1987,
      1988
    ],
    "LabelKey": "phase.GR.BK36.fiberglass_enlarged",
    "ReasonCodes": [
      "hull_redesign",
      "dimension_change"
    ],
    "ApplicabilityNote": "Enlarged fiberglass hull. 1987/88 is treated as a transition period rather than an exact universal cutoff.",
    "FactOverrides": [
      {
        "FieldID": "HullMaterialCode",
        "ValueState": "known",
        "CanonicalValue": "hull_material.fiberglass",
        "CanonicalUnit": null,
        "Confidence": "high",
        "EvidenceAssertionIDs": [
          "GRBK-36-CL-material"
        ],
        "ResolutionNote": null
      },
      {
        "FieldID": "LOA",
        "ValueState": "known",
        "CanonicalValue": 11.2268,
        "CanonicalUnit": "m",
        "Confidence": "high",
        "EvidenceAssertionIDs": [
          "GRBK-36-CL-sizechange"
        ],
        "ResolutionNote": "Enlarged hull length."
      },
      {
        "FieldID": "Beam",
        "ValueState": "known",
        "CanonicalValue": 3.8608,
        "CanonicalUnit": "m",
        "Confidence": "high",
        "EvidenceAssertionIDs": [
          "GRBK-36-CL-beamchange"
        ],
        "ResolutionNote": "Enlarged hull beam."
      }
    ],
    "EvidenceAssertionIDs": [
      "GRBK-36-CL-sizechange",
      "GRBK-36-CL-beamchange"
    ],
    "Notes": "Still the canonical Grand Banks 36 Classic; phase is used to resolve year-sensitive specifications."
  },
  {
    "ProductionPhaseID": "GRBK-42-CL:P1",
    "BoatModelID": "GRBK-42-CL",
    "Sequence": 1,
    "StartYear": 1975,
    "EndYear": 1990,
    "BoundaryPrecision": "transition_years",
    "TransitionYears": [
      1991,
      1992
    ],
    "LabelKey": "phase.GR.BK42.original",
    "ReasonCodes": [
      "hull_redesign",
      "dimension_change"
    ],
    "ApplicabilityNote": "Original 42 Classic hull before the 1991/92 enlargement.",
    "FactOverrides": [
      {
        "FieldID": "LOA",
        "ValueState": "known",
        "CanonicalValue": 12.9794,
        "CanonicalUnit": "m",
        "Confidence": "high",
        "EvidenceAssertionIDs": [
          "GRBK-42-CL-sizechange"
        ],
        "ResolutionNote": "Original hull length."
      },
      {
        "FieldID": "Beam",
        "ValueState": "known",
        "CanonicalValue": 4.1402,
        "CanonicalUnit": "m",
        "Confidence": "high",
        "EvidenceAssertionIDs": [
          "GRBK-42-CL-beamchange"
        ],
        "ResolutionNote": "Original hull beam."
      }
    ],
    "EvidenceAssertionIDs": [
      "GRBK-42-CL-sizechange",
      "GRBK-42-CL-beamchange"
    ],
    "Notes": "All production in this model run is fiberglass; phase distinction is dimensional/design, not a separate model name."
  },
  {
    "ProductionPhaseID": "GRBK-42-CL:P2",
    "BoatModelID": "GRBK-42-CL",
    "Sequence": 2,
    "StartYear": 1991,
    "EndYear": 2004,
    "BoundaryPrecision": "transition_years",
    "TransitionYears": [
      1991,
      1992
    ],
    "LabelKey": "phase.GR.BK42.enlarged",
    "ReasonCodes": [
      "hull_redesign",
      "dimension_change"
    ],
    "ApplicabilityNote": "Lengthened/widened hull beginning around 1991; some references describe the model-year change as 1992.",
    "FactOverrides": [
      {
        "FieldID": "LOA",
        "ValueState": "known",
        "CanonicalValue": 13.1826,
        "CanonicalUnit": "m",
        "Confidence": "high",
        "EvidenceAssertionIDs": [
          "GRBK-42-CL-sizechange"
        ],
        "ResolutionNote": "Enlarged hull length."
      },
      {
        "FieldID": "Beam",
        "ValueState": "known",
        "CanonicalValue": 4.2926,
        "CanonicalUnit": "m",
        "Confidence": "high",
        "EvidenceAssertionIDs": [
          "GRBK-42-CL-beamchange"
        ],
        "ResolutionNote": "Enlarged hull beam."
      }
    ],
    "EvidenceAssertionIDs": [
      "GRBK-42-CL-sizechange",
      "GRBK-42-CL-beamchange"
    ],
    "Notes": "Hull number evidence is preferable for 1991/92 boundary boats."
  },
  {
    "ProductionPhaseID": "MNSH-30-PI:P1",
    "BoatModelID": "MNSH-30-PI",
    "Sequence": 1,
    "StartYear": 1998,
    "EndYear": 2002,
    "BoundaryPrecision": "exact_year",
    "LabelKey": "phase.mainship.30pilot.original",
    "ReasonCodes": [
      "hull_redesign",
      "layout_change",
      "propulsion_change"
    ],